{
    "enabled": true,
    "domains": {
        "ALPHA": {
            "plane3": 0.50,
            "plane6": 0.35,
            "plane9": 0.15
        },
        "GEO": {
            "plane3": 0.20,
            "plane6": 0.30,
            "plane9": 0.50
        },
        "PRODUCT": {
            "plane3": 0.55,
            "plane6": 0.30,
            "plane9": 0.15
        },
        "SAFEGUARD": {
            "plane3": 0.30,
            "plane6": 0.30,
            "plane9": 0.40
        },
        "DEFAULT": {
            "plane3": 0.40,
            "plane6": 0.35,
            "plane9": 0.25
        }
    },
    "severity_thresholds": {
        "low": 0.3,
        "medium": 0.6,
        "high": 0.8
    },
    "max_shift": 0.3
}